{
  "case_id": "BENDING-DEMO-001",
  "standard": "СП 16.13330.2017",
  "action": "bending_member_strength",
  "member_class": 2,
  "load_is_static": true,
  "is_crane_runway_beam": false,
  "is_bimetal_beam": true,
  "moment_x_n_mm": 100000000.0,
  "moment_y_n_mm": 20000000.0,
  "bimoment_n_mm2": 10000000000.0,
  "minimum_net_section_modulus_x_mm3": 1000000.0,
  "minimum_net_section_modulus_y_mm3": 500000.0,
  "net_inertia_x_mm4": 200000000.0,
  "net_inertia_y_mm4": 100000000.0,
  "net_sectorial_inertia_mm6": 1000000000000.0,
  "minimum_net_sectorial_section_modulus_mm4": 100000000.0,
  "point_x_mm": 50.0,
  "point_y_mm": 200.0,
  "sectorial_coordinate_mm2": 10000.0,
  "shear_force_n": 100000.0,
  "first_moment_area_mm3": 200000.0,
  "gross_second_moment_area_mm4": 200000000.0,
  "web_thickness_mm": 8.0,
  "longitudinal_normal_stress_n_mm2": 100.0,
  "transverse_normal_stress_n_mm2": 20.0,
  "shear_stress_xy_n_mm2": 50.0,
  "normative_yield_resistance_n_mm2": 355.0,
  "design_yield_resistance_n_mm2": 355.0,
  "design_shear_resistance_n_mm2": 205.9,
  "working_condition_factor": 1.0,
  "web_has_bolt_holes": true,
  "hole_pitch_mm": 100.0,
  "hole_diameter_mm": 20.0,
  "figure_6_case": "welded_or_rolled",
  "bearing_width_mm": 100.0,
  "flange_and_weld_or_fillet_height_mm": 20.0,
  "distribution_coefficient_psi": 3.25,
  "flange_and_rail_inertia_mm4": 8000000.0,
  "concentrated_force_n": 80000.0,
  "table_e1_section_type": "1",
  "flange_to_web_area_ratio": 1.0,
  "minor_axis_moment_is_zero": false,
  "equivalent_load_safety_factor": 1.3,
  "plastic_section_family": "i_section",
  "required_clause_checks_confirmed": true,
  "is_support_section": false,
  "shear_stress_x_n_mm2": 100.0,
  "shear_stress_y_n_mm2": 20.0,
  "web_area_mm2": 1000.0,
  "one_flange_area_mm2": 500.0,
  "support_shear_force_x_n": 100000.0,
  "support_shear_force_y_n": 20000.0,
  "adjacent_span_1_mm": 10000.0,
  "adjacent_span_2_mm": 11000.0,
  "continuous_constant_section": true,
  "continuous_doubly_symmetric_section": true,
  "continuous_required_clause_checks_confirmed": true,
  "end_span_moment_1_n_mm": 120000000.0,
  "end_span_moment_2_n_mm": 150000000.0,
  "end_span_distance_1_mm": 0.0,
  "end_span_distance_2_mm": 5000.0,
  "end_span_length_mm": 10000.0,
  "intermediate_span_moment_n_mm": 160000000.0,
  "fixed_end_reference_moment_n_mm": 140000000.0,
  "maximum_elastic_moment_n_mm": 180000000.0,
  "redistribution_completed_in_x_plane": true,
  "redistribution_completed_in_y_plane": true,
  "clause_8_2_5_confirmed": true,
  "clause_8_4_6_confirmed": true,
  "clause_8_5_8_confirmed": true,
  "clause_8_5_9_confirmed": true,
  "clause_8_5_18_confirmed": true,
  "maximum_moment_sections_include_shear_effect": true,
  "web_design_yield_resistance_n_mm2": 300.0,
  "flange_design_yield_resistance_n_mm2": 355.0,
  "web_design_shear_resistance_n_mm2": 174.0,
  "flange_design_shear_resistance_n_mm2": 205.9,
  "flange_reference_coefficient_c_xf": 1.07,
  "bimetal_section_family": "i_section",
  "bimetal_has_two_symmetry_axes": true,
  "bimetal_required_clause_checks_confirmed": true,
  "bimetal_shear_stress_x_n_mm2": 100.0,
  "bimetal_shear_stress_y_n_mm2": 20.0,
  "bimetal_is_support_section": false
}
